Quote,Author,Tag
"“We believe in ordinary acts of bravery, in the courage that drives one person to stand up for another.”","Veronica Roth,",inspirational-quotes
"“Don't think or judge, just listen.”","Sarah Dessen,",inspirational-quotes
"“You can talk with someone for years, everyday, and still, it won't mean as much as what you can have when you sit in front of someone, not saying a word, yet you feel that person with your heart, you feel like you have known the person for forever.... connections are made with the heart, not the tongue.”",C. JoyBell C.,inspirational-quotes
"“One day, in retrospect, the years of struggle will strike you as the most beautiful.”",Sigmund Freud,inspirational-quotes
“Don't be afraid of your fears. They're not there to scare you. They're there to let you know that something is worth it.”,C. JoyBell C.,inspirational-quotes
"“If you want to forget something or someone, never hate it, or never hate him/her. Everything and everyone that you hate is engraved upon your heart; if you want to let go of something, if you want to forget, you cannot hate.”",C. JoyBell C.,inspirational-quotes
“Attitude is a choice. Happiness is a choice. Optimism is a choice. Kindness is a choice. Giving is a choice. Respect is a choice. Whatever choice you make makes you. Choose wisely.”,"Roy T. Bennett,",inspirational-quotes
"“We have to allow ourselves to be loved by the people who really love us, the people who really matter. Too much of the time, we are blinded by our own pursuits of people to love us, people that don't even matter, while all that time we waste and the people who do love us have to stand on the sidewalk and watch us beg in the streets! It's time to put an end to this. It's time for us to let ourselves be loved.”",C. JoyBell C.,inspirational-quotes
“Don't be pushed around by the fears in your mind. Be led by the dreams in your heart.”,"Roy T. Bennett,",inspirational-quotes
"“If you want to be happy, do not dwell in the past, do not worry about the future, focus on living fully in the present.”","Roy T. Bennett,",inspirational-quotes
"“Instead of worrying about what you cannot control, shift your energy to what you can create.”","Roy T. Bennett,",inspirational-quotes
"“You will find that it is necessary to let things go; simply for the reason that they are heavy. So let them go, let go of them. I tie no weights to my ankles.”",C. JoyBell C.,inspirational-quotes
"“It’s only after you’ve stepped outside your comfort zone that you begin to change, grow, and transform.”",Roy T. Bennett,inspirational-quotes
"“I have come to accept the feeling of not knowing where I am going. And I have trained myself to love it. Because it is only when we are suspended in mid-air with no landing in sight, that we force our wings to unravel and alas begin our flight. And as we fly, we still may not know where we are going to. But the miracle is in the unfolding of the wings. You may not know where you're going, but you know that so long as you spread your wings, the winds will carry you.”",C. JoyBell C.,inspirational-quotes
"“The only way that we can live, is if we grow. The only way that we can grow is if we change. The only way that we can change is if we learn. The only way we can learn is if we are exposed. And the only way that we can become exposed is if we throw ourselves out into the open. Do it. Throw yourself.”",C. JoyBell C.,inspirational-quotes
"“More smiling, less worrying. More compassion, less judgment. More blessed, less stressed. More love, less hate.”","Roy T. Bennett,",inspirational-quotes
"“Respect other people's feelings. It might mean nothing to you, but it could mean everything to them.”",Roy T. Bennett,inspirational-quotes
"“Take responsibility of your own happiness, never put it in other people’s hands.”","Roy T. Bennett,",inspirational-quotes
“Be mindful. Be grateful. Be positive. Be true. Be kind.”,"Roy T. Bennett,",inspirational-quotes
“Thinking something does not make it true. Wanting something does not make it real.”,"Michelle Hodkin,",inspirational-quotes
“Be the reason someone smiles. Be the reason someone feels loved and believes in the goodness in people.”,"Roy T. Bennett,",inspirational-quotes
"“Accept yourself, love yourself, and keep moving forward. If you want to fly, you have to give up what weighs you down.”","Roy T. Bennett,",inspirational-quotes
"“Do what is right, not what is easy nor what is popular.”","Roy T. Bennett,",inspirational-quotes
“Live the Life of Your Dreams: Be brave enough to live the life of your dreams according to your vision and purpose instead of the expectations and opinions of others.”,"Roy T. Bennett,",inspirational-quotes
"“Believe in Your HeartBelieve in your heart that you're meant to live a life full of passion, purpose, magic and miracles.”","Roy T. Bennett,",inspirational-quotes
"“The past is a place of reference, not a place of residence; the past is a place of learning, not a place of living.”","Roy T. Bennett,",inspirational-quotes
"“Life is too short to waste any amount of time on wondering what other people think about you. In the first place, if they had better things going on in their lives, they wouldn't have the time to sit around and talk about you. What's important to me is not others' opinions of me, but what's important to me is my opinion of myself.”",C. JoyBell C.,inspirational-quotes
"“Follow your heart, listen to your inner voice, stop caring about what others think.”","Roy T. Bennett,",inspirational-quotes
"“Be grateful for what you already have while you pursue your goals. If you aren’t grateful for what you already have, what makes you think you would be happy with more.”","Roy T. Bennett,",inspirational-quotes
"“Acts of Kindness:A random act of kindness, no matter how small, can make a tremendous impact on someone else's life.”","Roy T. Bennett,",inspirational-quotes
“Life becomes easier and more beautiful when we can see the good in other people.”,Roy T. Bennett,inspirational-quotes
"“We can't be afraid of change. You may feel very secure in the pond that you are in, but if you never venture out of it, you will never know that there is such a thing as an ocean, a sea. Holding onto something that is good for you now, may be the very reason why you don't have something better.”",C. JoyBell C.,inspirational-quotes
"“Don't let the expectations and opinions of other people affect your decisions. It's your life, not theirs. Do what matters most to you; do what makes you feel alive and happy. Don't let the expectations and ideas of others limit who you are. If you let others tell you who you are, you are living their reality — not yours. There is more to life than pleasing people. There is much more to life than following others' prescribed path. There is so much more to life than what you experience right now. You need to decide who you are for yourself. Become a whole being. Adventure.”",Roy T. Bennett,inspirational-quotes
"“Make improvements, not excuses. Seek respect, not attention.”","Roy T. Bennett,",inspirational-quotes
"“There will be a few times in your life when all your instincts will tell you to do something, something that defies logic, upsets your plans, and may seem crazy to others. When that happens, you do it. Listen to your instincts and ignore everything else. Ignore logic, ignore the odds, ignore the complications, and just go for it.”","Judith McNaught,",inspirational-quotes
“You never change your life until you step out of your comfort zone; change begins at the end of your comfort zone.”,Roy T. Bennett,inspirational-quotes
"“There is no such thing as a ""broken family."" Family is family, and is not determined by marriage certificates, divorce papers, and adoption documents. Families are made in the heart. The only time family becomes null is when those ties in the heart are cut. If you cut those ties, those people are not your family. If you make those ties, those people are your family. And if you hate those ties, those people will still be your family because whatever you hate will always be with you.”",C. JoyBell C.,inspirational-quotes
"“Life is about accepting the challenges along the way, choosing to keep moving forward, and savoring the journey.”","Roy T. Bennett,",inspirational-quotes
"“Pursue what catches your heart, not what catches your eyes.”","Roy T. Bennett,",inspirational-quotes
"“Do not let the memories of your past limit the potential of your future. There are no limits to what you can achieve on your journey through life, except in your mind.”","Roy T. Bennett,",inspirational-quotes
"“Don’t waste your time in anger, regrets, worries, and grudges. Life is too short to be unhappy.”",Roy T. Bennett,inspirational-quotes
"“The unhappiest people in this world, are those who care the most about what other people think.”",C. JoyBell C.,inspirational-quotes
"“Success is not how high you have climbed, but how you make a positive difference to the world.”","Roy T. Bennett,",inspirational-quotes
"“No amount of regretting can change the past, and no amount of worrying can change the future.”","Roy T. Bennett,",inspirational-quotes
“Learn to light a candle in the darkest moments of someone’s life. Be the light that helps others see; it is what gives life its deepest significance.”,"Roy T. Bennett,",inspirational-quotes
“Keep GoingYour hardest times often lead to the greatest moments of your life. Keep going. Tough situations build strong people in the end.”,"Roy T. Bennett,",inspirational-quotes
"“Believe in yourself. You are braver than you think, more talented than you know, and capable of more than you imagine.”","Roy T. Bennett,",inspirational-quotes
“Do not fear failure but rather fear not trying.”,"Roy T. Bennett,",inspirational-quotes
"“Pain is a pesky part of being human, I've learned it feels like a stab wound to the heart, something I wish we could all do without, in our lives here. Pain is a sudden hurt that can't be escaped. But then I have also learned that because of pain, I can feel the beauty, tenderness, and freedom of healing. Pain feels like a fast stab wound to the heart. But then healing feels like the wind against your face when you are spreading your wings and flying through the air! We may not have wings growing out of our backs, but healing is the closest thing that will give us that wind against our faces.”",C. JoyBell C.,inspirational-quotes
"“Treat everyone with politeness and kindness, not because they are nice, but because you are.”","Roy T. Bennett,",inspirational-quotes
“Be brave to stand for what you believe in even if you stand alone.”,"Roy T. Bennett,",inspirational-quotes
"“Always find opportunities to make someone smile, and to offer random acts of kindness in everyday life.”","Roy T. Bennett,",inspirational-quotes
"“No matter what happens, or how bad it seems today, life does go on, and it will be better tomorrow.”",Maya Angelou,inspirational-quotes
“Start each day with a positive thought and a grateful heart.”,"Roy T. Bennett,",inspirational-quotes
"“You cannot control the behavior of others, but you can always choose how you respond to it.”","Roy T. Bennett,",inspirational-quotes
"“Even if you cannot change all the people around you, you can change the people you choose to be around. Life is too short to waste your time on people who don’t respect, appreciate, and value you. Spend your life with people who make you smile, laugh, and feel loved.”","Roy T. Bennett,",inspirational-quotes
“Top 15 Things Money Can’t BuyTime. Happiness. Inner Peace. Integrity. Love. Character. Manners. Health. Respect. Morals. Trust. Patience. Class. Common sense. Dignity.”,"Roy T. Bennett,",inspirational-quotes
“To shine your brightest light is to be who you truly are.”,Roy T. Bennett,inspirational-quotes
"“Don't JustDon't just learn, experience.Don't just read, absorb.Don't just change, transform.Don't just relate, advocate.Don't just promise, prove.Don't just criticize, encourage.Don't just think, ponder.Don't just take, give.Don't just see, feel.Don’t just dream, do. Don't just hear, listen.Don't just talk, act.Don't just tell, show.Don't just exist, live.”","Roy T. Bennett,",inspirational-quotes
“Never lose hope. Storms make people stronger and never last forever.”,"Roy T. Bennett,",inspirational-quotes
“Sometimes you have to lose all you have to find out who you truly are.”,"Roy T. Bennett,",inspirational-quotes
“Be thankful for everything that happens in your life; it’s all an experience.”,Roy T. Bennett,inspirational-quotes
“You are not rich until you have a rich heart.”,"Roy T. Bennett,",inspirational-quotes
"“Last night I lost the world, and gained the universe.”",C. JoyBell C.,inspirational-quotes
"“Time doesn’t heal emotional pain, you need to learn how to let go.”","Roy T. Bennett,",inspirational-quotes
“Let the improvement of yourself keep you so busy that you have no time to criticize others.”,"Roy T. Bennett,",inspirational-quotes
"“Stop comparing yourself to other people, just choose to be happy and live your own life.”","Roy T. Bennett,",inspirational-quotes
“Do not set aside your happiness. Do not wait to be happy in the future. The best time to be happy is always now.”,Roy T. Bennett,inspirational-quotes
"“True happiness is to enjoy the present, without anxious dependence upon the future, not to amuse ourselves with either hopes or fears but to rest satisfied with what we have, which is sufficient, for he that is so wants nothing. The greatest blessings of mankind are within us and within our reach. A wise man is content with his lot, whatever it may be, without wishing for what he has not.”",Seneca,inspirational-quotes
"“There is some kind of a sweet innocence in being human- in not having to be just happy or just sad- in the nature of being able to be both broken and whole, at the same time.”",C. JoyBell C.,inspirational-quotes
“Help others without any reason and give without the expectation of receiving anything in return.”,"Roy T. Bennett,",inspirational-quotes
"“I think that we are like stars. Something happens to burst us open; but when we burst open and think we are dying; we’re actually turning into a supernova. And then when we look at ourselves again, we see that we’re suddenly more beautiful than we ever were before!”",C. JoyBell C.,inspirational-quotes
"“They say a good love is one that sits you down, gives you a drink of water, and pats you on top of the head. But I say a good love is one that casts you into the wind, sets you ablaze, makes you burn through the skies and ignite the night like a phoenix; the kind that cuts you loose like a wildfire and you can't stop running simply because you keep on burning everything that you touch! I say that's a good love; one that burns and flies, and you run with it!”",C. JoyBell C.,inspirational-quotes
"“Listen with curiosity. Speak with honesty. Act with integrity. The greatest problem with communication is we don’t listen to understand. We listen to reply. When we listen with curiosity, we don’t listen with the intent to reply. We listen for what’s behind the words.”","Roy T. Bennett,",inspirational-quotes
"“No one loses anyone, because no one owns anyone. That is the true experience of freedom: having the most important thing in the world without owning it”","Paulo Coelho,",inspirational-quotes
"“Great things happen to those who don't stop believing, trying, learning, and being grateful.”","Roy T. Bennett,",inspirational-quotes
"“If you believe very strongly in something, stand up and fight for it.”","Roy T. Bennett,",inspirational-quotes
“Believe in your infinite potential. Your only limitations are those you set upon yourself.”,"Roy T. Bennett,",inspirational-quotes
“It’s your life; you don’t need someone’s permission to live the life you want. Be brave to live from your heart.”,"Roy T. Bennett,",inspirational-quotes
"“You can be the most beautiful person in the world and everybody sees light and rainbows when they look at you, but if you yourself don't know it, all of that doesn't even matter. Every second that you spend on doubting your worth, every moment that you use to criticize yourself; is a second of your life wasted, is a moment of your life thrown away. It's not like you have forever, so don't waste any of your seconds, don't throw even one of your moments away.”",C. JoyBell C.,inspirational-quotes
"“Always remember people who have helped you along the way, and don’t forget to lift someone up.”","Roy T. Bennett,",inspirational-quotes
"“Surround Yourself with People Who Believe in Your Dreams:Surround yourself with people who believe in your dreams, encourage your ideas, support your ambitions, and bring out the best in you.”","Roy T. Bennett,",inspirational-quotes
"“Maturity is when you stop complaining and making excuses, and start making changes.”","Roy T. Bennett,",inspirational-quotes
"“The more you feed your mind with positive thoughts, the more you can attract great things into your life.”","Roy T. Bennett,",inspirational-quotes
"“People have to forgive. We don't have to like them, we don't have to be friends with them, we don't have to send them hearts in text messages, but we have to forgive them, to overlook, to forget. Because if we don't we are tying rocks to our feet, too much for our wings to carry!”",C. JoyBell C.,inspirational-quotes
"“When the going gets tough, put one foot in front of the other and just keep going. Don’t give up.”","Roy T. Bennett,",inspirational-quotes
"“Home is the place where, when you have to go there, they have to take you in.”",Robert Frost,inspirational-quotes
“I believe there is another world waiting for us. A better world. And I'll be waiting for you there.”,"David Mitchell,",inspirational-quotes
“Happiness depends on your mindset and attitude.”,"Roy T. Bennett,",inspirational-quotes
“Strong people have a strong sense of self-worth and self-awareness; they don’t need the approval of others.”,"Roy T. Bennett,",inspirational-quotes
